{
  "verifiedAt": "2026-04-28",
  "maxAgeDays": 120,
  "platformEvidence": [
    {
      "platformId": "codex-cli",
      "status": "sourced",
      "evidenceType": "official-docs-and-runtime",
      "path": "plans/platforms/codex-cli.md",
      "verifiedAt": "2026-04-28"
    },
    {
      "platformId": "opencode",
      "status": "sourced",
      "evidenceType": "official-docs-and-runtime",
      "path": "plans/platforms/opencode.md",
      "verifiedAt": "2026-04-28"
    },
    {
      "platformId": "kilo-code-v5",
      "status": "partial",
      "evidenceType": "source",
      "path": "plans/platforms/kilo-code.md",
      "verifiedAt": "2026-04-25"
    }
  ],
  "requiredPlanPaths": [
    "plans/platforms/codex-cli.md",
    "plans/platforms/opencode.md",
    "plans/platforms/kilo-code.md",
    "plans/source-dives/codex-cli.md",
    "plans/source-dives/opencode.md",
    "plans/source-dives/kilo-code-v5.md"
  ],
  "forbiddenActiveTerms": [
    "spark"
  ],
  "requiredTerms": [
    "gpt-5.4-mini",
    "opencode/big-pickle",
    "opencode/nemotron-3-super-free",
    "Kilo-Org/kilocode-legacy",
    "v3_to_be_removed/"
  ]
}
